{
  "source_sha256": "0123456789abcdef0123456789abcdef0123456789abcdef0123456789abcdef",
  "test_suite_digest": "sha256:0123456789abcdef0123456789abcdef0123456789abcdef0123456789abcdef",
  "sample_rate": 48000,
  "block_size": 64,
  "seed": 1,
  "metrics": {
    "comparison": "reward-graded-signed-full",
    "signed_frames": 144000,
    "frame_count": 144000,
    "head_frames": 2048
  },
  "thresholds": {
    "reward_graded": true
  },
  "passed": true,
  "harness_digest": "sha256:fedcba9876543210fedcba9876543210fedcba9876543210fedcba9876543210",
  "renderer": "faustwasm",
  "purpose": "reward",
  "profile": {
    "frames": 144000,
    "head_frames": 2048,
    "max_frames": 144000
  }
}
